{"claims":[{"claim_hash":"fa6d655231d4926e5466f0905ab4e43cd86cde6693cb7355b7cbefeac192cfc3","claim_id":"CLM-EXT-001","evidence_paths":["audit/corruption_report.json","audit/independent_audit.json","processed/case_results.parquet"],"generated_text":"The Apache Polaris OPA certificate-target experiment is a valid external operational measurement under the preregistered finite contract.","predicate":"independent core audit passes and all twelve corruptions are detected","prohibited_dependencies":["deployment_readiness","prevalence","superiority"],"supported":true},{"claim_hash":"a1fd2cc51493c2174ab030123392c1d67f2f565281b2816f4099bac280acf93e","claim_id":"CLM-RESULT-001","evidence_paths":["audit/corruption_report.json","audit/independent_audit.json","processed/case_results.parquet"],"generated_text":"In this independently engineered Apache Polaris instance, unrestricted closure costs one unit intervention and R-frozen closure is unreachable for all eight source-selected certificate cases.","predicate":"every retained native case is audit-eligible and has a positive Delta_R relation","prohibited_dependencies":["deployment_readiness","prevalence","superiority"],"supported":true},{"claim_hash":"a851bbca05f278d016a0951c4f6b0f7a38149f358a441576cc2221880ed494b2","claim_id":"CLM-QUAL-001","evidence_paths":["contract/route_classification.json","processed/case_results.parquet"],"generated_text":"The result is qualified as SINGLE_ACTION because the frozen source establishes one admitted historical repair action and no competing repair route.","predicate":"every measured case carries the preregistered SINGLE_ACTION route qualifier","prohibited_dependencies":["deployment_readiness","prevalence","superiority"],"supported":true},{"claim_hash":"5e995d1d7fb834e0dd42e4abada8984c39663d2a22c685a5b2ff960c0f5f6072","claim_id":"CLM-NONCLAIM-001","evidence_paths":["preregistration/preregistration.json","reports/claim_ledger.json"],"generated_text":"This experiment does not estimate how prevalent positive resource dependence is.","predicate":"the preregistered prevalence flag remains false","prohibited_dependencies":["deployment_readiness","prevalence","superiority"],"supported":true},{"claim_hash":"32ea0a8fcf6fec55f7548d80242e36c4790ab0cff8ebd8c5b64a6373f2c1d637","claim_id":"CLM-NONCLAIM-002","evidence_paths":["preregistration/preregistration.json","reports/claim_ledger.json"],"generated_text":"This experiment does not establish superiority over another authorization architecture.","predicate":"the preregistered superiority flag remains false","prohibited_dependencies":["deployment_readiness","prevalence","superiority"],"supported":true},{"claim_hash":"73cb03d37fca49997a792528595369cefb7a618b2b4a55d0fe1c10b872006266","claim_id":"CLM-NONCLAIM-003","evidence_paths":["preregistration/preregistration.json","reports/claim_ledger.json"],"generated_text":"This experiment does not establish deployment readiness or universal correctness.","predicate":"the preregistered deployment-readiness flag remains false","prohibited_dependencies":["deployment_readiness","prevalence","superiority"],"supported":true}],"external_operational_validation":true,"ledger_hash":"cbd57c09562dbc3a451fba0f5cc0ff9340f327bc8fee5160265b8288a4cdf3e2","locked_flags":{"deployment_readiness":false,"prevalence":false,"superiority":false},"result_sign":"POSITIVE","run_id":"external_v01_polaris_pr4992"}
